{
  "active_steps": [],
  "completed_steps": [],
  "eligible_tasks": [
    "plan"
  ],
  "governance": {
    "claims": {},
    "handoff": null,
    "permissions": {},
    "remediation": {},
    "reviews": {}
  },
  "graph_revision": "g0001",
  "integrity_level": "verified",
  "last_event_digest": "bdbd17454f43e1f8923304e5f528244d12a75829e5ed5f2668bcc77b2fb1d31e",
  "last_event_seq": 1,
  "pending_provider_operations": [],
  "run_id": "run-001",
  "run_status": "CREATED",
  "schema_version": "1.0.0",
  "state_revision": 1,
  "tasks": {
    "brand": {
      "attempts": 0,
      "evidence": [],
      "graph_revision": "g0001",
      "last_attempt_id": null,
      "last_error": null,
      "owner": null,
      "pending_actions": [],
      "retry": null,
      "review": null,
      "status": "WAIT_DEPENDENCY"
    },
    "copy": {
      "attempts": 0,
      "evidence": [],
      "graph_revision": "g0001",
      "last_attempt_id": null,
      "last_error": null,
      "owner": null,
      "pending_actions": [],
      "retry": null,
      "review": null,
      "status": "WAIT_DEPENDENCY"
    },
    "creative-brief": {
      "attempts": 0,
      "evidence": [],
      "graph_revision": "g0001",
      "last_attempt_id": null,
      "last_error": null,
      "owner": null,
      "pending_actions": [],
      "retry": null,
      "review": null,
      "status": "WAIT_DEPENDENCY"
    },
    "creative-qa": {
      "attempts": 0,
      "evidence": [],
      "graph_revision": "g0001",
      "last_attempt_id": null,
      "last_error": null,
      "owner": null,
      "pending_actions": [],
      "retry": null,
      "review": null,
      "status": "WAIT_DEPENDENCY"
    },
    "crm": {
      "attempts": 0,
      "evidence": [],
      "graph_revision": "g0001",
      "last_attempt_id": null,
      "last_error": null,
      "owner": null,
      "pending_actions": [],
      "retry": null,
      "review": null,
      "status": "WAIT_DEPENDENCY"
    },
    "evidence": {
      "attempts": 0,
      "evidence": [],
      "graph_revision": "g0001",
      "last_attempt_id": null,
      "last_error": null,
      "owner": null,
      "pending_actions": [],
      "retry": null,
      "review": null,
      "status": "WAIT_DEPENDENCY"
    },
    "integration": {
      "attempts": 0,
      "evidence": [],
      "graph_revision": "g0001",
      "last_attempt_id": null,
      "last_error": null,
      "owner": null,
      "pending_actions": [],
      "retry": null,
      "review": null,
      "status": "WAIT_DEPENDENCY"
    },
    "keywords": {
      "attempts": 0,
      "evidence": [],
      "graph_revision": "g0001",
      "last_attempt_id": null,
      "last_error": null,
      "owner": null,
      "pending_actions": [],
      "retry": null,
      "review": null,
      "status": "WAIT_DEPENDENCY"
    },
    "landing": {
      "attempts": 0,
      "evidence": [],
      "graph_revision": "g0001",
      "last_attempt_id": null,
      "last_error": null,
      "owner": null,
      "pending_actions": [],
      "retry": null,
      "review": null,
      "status": "WAIT_DEPENDENCY"
    },
    "launch-approval": {
      "attempts": 0,
      "evidence": [],
      "graph_revision": "g0001",
      "last_attempt_id": null,
      "last_error": null,
      "owner": null,
      "pending_actions": [],
      "retry": null,
      "review": null,
      "status": "WAIT_DEPENDENCY"
    },
    "media": {
      "attempts": 0,
      "evidence": [],
      "graph_revision": "g0001",
      "last_attempt_id": null,
      "last_error": null,
      "owner": null,
      "pending_actions": [],
      "retry": null,
      "review": null,
      "status": "WAIT_DEPENDENCY"
    },
    "meta-plan": {
      "attempts": 0,
      "evidence": [],
      "graph_revision": "g0001",
      "last_attempt_id": null,
      "last_error": null,
      "owner": null,
      "pending_actions": [],
      "retry": null,
      "review": null,
      "status": "WAIT_DEPENDENCY"
    },
    "monitor": {
      "attempts": 0,
      "evidence": [],
      "graph_revision": "g0001",
      "last_attempt_id": null,
      "last_error": null,
      "owner": null,
      "pending_actions": [],
      "retry": null,
      "review": null,
      "status": "WAIT_DEPENDENCY"
    },
    "offer-hypothesis": {
      "attempts": 0,
      "evidence": [],
      "graph_revision": "g0001",
      "last_attempt_id": null,
      "last_error": null,
      "owner": null,
      "pending_actions": [],
      "retry": null,
      "review": null,
      "status": "WAIT_DEPENDENCY"
    },
    "offer-verified": {
      "attempts": 0,
      "evidence": [],
      "graph_revision": "g0001",
      "last_attempt_id": null,
      "last_error": null,
      "owner": null,
      "pending_actions": [],
      "retry": null,
      "review": null,
      "status": "WAIT_DEPENDENCY"
    },
    "optimize": {
      "attempts": 0,
      "evidence": [],
      "graph_revision": "g0001",
      "last_attempt_id": null,
      "last_error": null,
      "owner": null,
      "pending_actions": [],
      "retry": null,
      "review": null,
      "status": "WAIT_DEPENDENCY"
    },
    "plan": {
      "attempts": 0,
      "evidence": [],
      "graph_revision": "g0001",
      "last_attempt_id": null,
      "last_error": null,
      "owner": null,
      "pending_actions": [],
      "retry": null,
      "review": null,
      "status": "READY"
    },
    "research-fanout": {
      "attempts": 0,
      "evidence": [],
      "graph_revision": "g0001",
      "last_attempt_id": null,
      "last_error": null,
      "owner": null,
      "pending_actions": [],
      "retry": null,
      "review": null,
      "status": "WAIT_DEPENDENCY"
    },
    "research-peer-review": {
      "attempts": 0,
      "evidence": [],
      "graph_revision": "g0001",
      "last_attempt_id": null,
      "last_error": null,
      "owner": null,
      "pending_actions": [],
      "retry": null,
      "review": null,
      "status": "WAIT_DEPENDENCY"
    },
    "score": {
      "attempts": 0,
      "evidence": [],
      "graph_revision": "g0001",
      "last_attempt_id": null,
      "last_error": null,
      "owner": null,
      "pending_actions": [],
      "retry": null,
      "review": null,
      "status": "WAIT_DEPENDENCY"
    },
    "tracking": {
      "attempts": 0,
      "evidence": [],
      "graph_revision": "g0001",
      "last_attempt_id": null,
      "last_error": null,
      "owner": null,
      "pending_actions": [],
      "retry": null,
      "review": null,
      "status": "WAIT_DEPENDENCY"
    }
  },
  "updated_at": "2026-10-20T11:52:25Z"
}
